{
  "kind": "neutrino.m7-core-installed-export/1",
  "schemaVersion": 1,
  "cppAbiPolicy": "forbidden",
  "protocolContract": {
    "boundary": "share/neutrino/docs/M7_BACKEND_PACKAGE_BOUNDARY_ADR.md",
    "canonicalProjectionSchema": "share/neutrino/schemas/finalized-projection-v1.schema.json",
    "protocol": "neutrino.backend-protocol/1",
    "startup": "neutrino.backend-startup/1"
  },
  "runtimeArtifacts": [
    "bin/neutrino-bundle",
    "bin/neutrino-emit",
    "bin/neutrino-equiv",
    "bin/neutrino-gen",
    "bin/neutrino-opt",
    "bin/neutrino-translate"
  ],
  "dataArtifacts": [
    "share/neutrino/docs/M7_BACKEND_PACKAGE_BOUNDARY_ADR.md",
    "share/neutrino/m7-core-installed-export.json",
    "share/neutrino/schemas/agreement-identity.schema.json",
    "share/neutrino/schemas/capability-spec-validation.schema.json",
    "share/neutrino/schemas/capability-spec.schema.json",
    "share/neutrino/schemas/finalized-projection-v1.schema.json",
    "share/neutrino/schemas/semantic-requirements.schema.json",
    "share/neutrino/schemas/test-realization.schema.json"
  ],
  "internalTargets": [
    "NeutrinoAnalysis",
    "NeutrinoCapabilityProfile",
    "NeutrinoCoverageCore",
    "NeutrinoCoverageSpec",
    "NeutrinoDialect",
    "NeutrinoDomainSemantics",
    "NeutrinoEmit",
    "NeutrinoFrontend",
    "NeutrinoL2",
    "NeutrinoSecurityCore",
    "NeutrinoSecurityPolicy",
    "NeutrinoSlotCore",
    "NeutrinoSlotSpec",
    "NeutrinoSpecContract",
    "NeutrinoTargetCatalog",
    "NeutrinoTooling",
    "NeutrinoViewsCore",
    "NeutrinoViewsSpec"
  ],
  "internalSourceHeaders": [
    "include/Neutrino/AgreementEnvelope.h",
    "include/Neutrino/Analysis.h",
    "include/Neutrino/ArtifactPublication.h",
    "include/Neutrino/Attestation.h",
    "include/Neutrino/BackendDispatchReceipt.h",
    "include/Neutrino/BackendInvoker.h",
    "include/Neutrino/BackendPackage.h",
    "include/Neutrino/BackendProjection.h",
    "include/Neutrino/BackendProjectionCodec.h",
    "include/Neutrino/BackendProtocol.h",
    "include/Neutrino/BackendStartup.h",
    "include/Neutrino/BoundedCoordinator.h",
    "include/Neutrino/CanonicalLabels.h",
    "include/Neutrino/CoordinationEval.h",
    "include/Neutrino/CoordinationPlan.h",
    "include/Neutrino/CoordinationPlanBuild.h",
    "include/Neutrino/DiagnosticTaxonomy.def",
    "include/Neutrino/DiagnosticTaxonomy.h",
    "include/Neutrino/Diagnostics.h",
    "include/Neutrino/Emit.h",
    "include/Neutrino/CoordinationEnvelope.h",
    "include/Neutrino/Expr.h",
    "include/Neutrino/ExprAttr.h",
    "include/Neutrino/Frontend.h",
    "include/Neutrino/GenAgreementEnvelope.h",
    "include/Neutrino/GenCapabilityModelSpec.h",
    "include/Neutrino/GenCoordinationPlan.h",
    "include/Neutrino/GenCoordinationTrace.h",
    "include/Neutrino/GenCoverage.h",
    "include/Neutrino/GenCoverageSpec.h",
    "include/Neutrino/GenDomainSemantics.h",
    "include/Neutrino/GenSecurity.h",
    "include/Neutrino/GenSecuritySpec.h",
    "include/Neutrino/GenSemanticRequirements.h",
    "include/Neutrino/GenSlot.h",
    "include/Neutrino/GenSlotSpec.h",
    "include/Neutrino/GenSpec.h",
    "include/Neutrino/GenViews.h",
    "include/Neutrino/GenViewsSpec.h",
    "include/Neutrino/JsonUtil.h",
    "include/Neutrino/L2Dialect.h",
    "include/Neutrino/L2Imports.h",
    "include/Neutrino/L2Reduction.h",
    "include/Neutrino/LanguageMetadata.h",
    "include/Neutrino/LanguageVocabulary.def",
    "include/Neutrino/LanguageVocabulary.h",
    "include/Neutrino/Lexer.h",
    "include/Neutrino/Lifecycle.h",
    "include/Neutrino/LifecycleView.h",
    "include/Neutrino/Manifest.h",
    "include/Neutrino/NeutrinoDialect.h",
    "include/Neutrino/ParseUtil.h",
    "include/Neutrino/PlanLegality.h",
    "include/Neutrino/ProjectionGateMode.h",
    "include/Neutrino/Scenario.h",
    "include/Neutrino/SelfEmittedSpec.h",
    "include/Neutrino/SemanticRequirements.h",
    "include/Neutrino/SourceLoad.h",
    "include/Neutrino/SpecLegality.h",
    "include/Neutrino/StrCase.h",
    "include/Neutrino/TargetCatalog.h",
    "include/Neutrino/TargetRegistry.def",
    "include/Neutrino/Targets.h",
    "include/Neutrino/TestRealization.h",
    "include/Neutrino/TraceEquivalence.h",
    "include/Neutrino/Validate.h",
    "include/Neutrino/ValueModel.h",
    "include/Neutrino/Version.h",
    "include/Neutrino/VersionInfo.h",
    "include/Neutrino/View.h"
  ],
  "internalGeneratedHeaders": [
    "include/Neutrino/BuildInfo.h",
    "include/Neutrino/L2Dialect.h.inc",
    "include/Neutrino/L2Ops.h.inc",
    "include/Neutrino/NeutrinoAttrs.h.inc",
    "include/Neutrino/NeutrinoDialect.h.inc",
    "include/Neutrino/NeutrinoOps.h.inc",
    "include/Neutrino/NeutrinoTypes.h.inc"
  ],
  "publicTargets": [],
  "publicHeaders": [],
  "cmakeExports": []
}
